{
 "format": "bibliopolis.world",
 "version": 1,
 "rule": {"max":40,"min":10,"auto":false},
 "items": [
  {"id":"h0001","title":"Title 1","authors":["A. Author"],"year":2020,"doi":"10.0000/h.0001","type":"article","openalex":[]},
  {"id":"h0002","title":"Title 2","authors":["A. Author"],"year":2020,"doi":"10.0000/h.0002","type":"article","openalex":[]},
  {"id":"h0003","title":"Title 3","authors":["A. Author"],"year":2020,"doi":"10.0000/h.0003","type":"article","openalex":[]},
  {"id":"h0004","title":"Title 4","authors":["A. Author"],"year":2020,"doi":"10.0000/h.0004","type":"article","openalex":[]},
  {"id":"h0005","title":"Title 5","authors":["A. Author"],"year":2020,"doi":"10.0000/h.0005","type":"article","openalex":[]},
  {"id":"h0006","title":"Title 6","authors":["A. Author"],"year":2020,"doi":"10.0000/h.0006","type":"article","openalex":[]},
  {"id":"h0007","title":"Title 7","authors":["A. Author"],"year":2020,"doi":"10.0000/h.0007","type":"article","openalex":[]},
  {"id":"h0008","title":"Title 8","authors":["A. Author"],"year":2020,"doi":"10.0000/h.0008","type":"article","openalex":[]},
  {"id":"h0009","title":"Title 9","authors":["A. Author"],"year":2020,"doi":"10.0000/h.0009","type":"article","openalex":[]},
  {"id":"h0010","title":"Title 10","authors":["A. Author"],"year":2020,"doi":"10.0000/h.0010","type":"article","openalex":[]},
  {"id":"h0011","title":"Title 11","authors":["A. Author"],"year":2020,"doi":"10.0000/h.0011","type":"article","openalex":[]},
  {"id":"h0012","title":"Title 12","authors":["A. Author"],"year":2020,"doi":"10.0000/h.0012","type":"article","openalex":[]},
  {"id":"h0013","title":"Title 13","authors":["A. Author"],"year":2020,"doi":"10.0000/h.0013","type":"article","openalex":[]},
  {"id":"h0014","title":"Title 14","authors":["A. Author"],"year":2020,"doi":"10.0000/h.0014","type":"article","openalex":[]},
  {"id":"h0015","title":"Title 15","authors":["A. Author"],"year":2020,"doi":"10.0000/h.0015","type":"article","openalex":[]},
  {"id":"h0016","title":"Title 16","authors":["A. Author"],"year":2020,"doi":"10.0000/h.0016","type":"article","openalex":[]},
  {"id":"h0017","title":"Title 17","authors":["A. Author"],"year":2020,"doi":"10.0000/h.0017","type":"article","openalex":[]},
  {"id":"h0018","title":"Title 18","authors":["A. Author"],"year":2020,"doi":"10.0000/h.0018","type":"article","openalex":[]},
  {"id":"h0019","title":"Title 19","authors":["A. Author"],"year":2020,"doi":"10.0000/h.0019","type":"article","openalex":[]},
  {"id":"h0020","title":"Title 20","authors":["A. Author"],"year":2020,"doi":"10.0000/h.0020","type":"article","openalex":[]},
  {"id":"h0021","title":"Title 21","authors":["A. Author"],"year":2020,"doi":"10.0000/h.0021","type":"article","openalex":[]},
  {"id":"h0022","title":"Title 22","authors":["A. Author"],"year":2020,"doi":"10.0000/h.0022","type":"article","openalex":[]},
  {"id":"h0023","title":"Title 23","authors":["A. Author"],"year":2020,"doi":"10.0000/h.0023","type":"article","openalex":[]},
  {"id":"h0024","title":"Title 24","authors":["A. Author"],"year":2020,"doi":"10.0000/h.0024","type":"article","openalex":[]},
  {"id":"h0025","title":"Title 25","authors":["A. Author"],"year":2020,"doi":"10.0000/h.0025","type":"article","openalex":[]},
  {"id":"h0026","title":"Title 26","authors":["A. Author"],"year":2020,"doi":"10.0000/h.0026","type":"article","openalex":[]},
  {"id":"h0027","title":"Title 27","authors":["A. Author"],"year":2020,"doi":"10.0000/h.0027","type":"article","openalex":[]},
  {"id":"h0028","title":"Title 28","authors":["A. Author"],"year":2020,"doi":"10.0000/h.0028","type":"article","openalex":[]},
  {"id":"h0029","title":"Title 29","authors":["A. Author"],"year":2020,"doi":"10.0000/h.0029","type":"article","openalex":[]},
  {"id":"h0030","title":"Title 30","authors":["A. Author"],"year":2020,"doi":"10.0000/h.0030","type":"article","openalex":[]},
  {"id":"h0031","title":"Title 31","authors":["A. Author"],"year":2020,"doi":"10.0000/h.0031","type":"article","openalex":[]},
  {"id":"h0032","title":"Title 32","authors":["A. Author"],"year":2020,"doi":"10.0000/h.0032","type":"article","openalex":[]},
  {"id":"h0033","title":"Title 33","authors":["A. Author"],"year":2020,"doi":"10.0000/h.0033","type":"article","openalex":[]},
  {"id":"h0034","title":"Title 34","authors":["A. Author"],"year":2020,"doi":"10.0000/h.0034","type":"article","openalex":[]},
  {"id":"h0035","title":"Title 35","authors":["A. Author"],"year":2020,"doi":"10.0000/h.0035","type":"article","openalex":[]},
  {"id":"h0036","title":"Title 36","authors":["A. Author"],"year":2020,"doi":"10.0000/h.0036","type":"article","openalex":[]},
  {"id":"h0037","title":"Title 37","authors":["A. Author"],"year":2020,"doi":"10.0000/h.0037","type":"article","openalex":[]},
  {"id":"h0038","title":"Title 38","authors":["A. Author"],"year":2020,"doi":"10.0000/h.0038","type":"article","openalex":[]},
  {"id":"h0039","title":"Title 39","authors":["A. Author"],"year":2020,"doi":"10.0000/h.0039","type":"article","openalex":[]},
  {"id":"h0040","title":"Title 40","authors":["A. Author"],"year":2020,"doi":"10.0000/h.0040","type":"article","openalex":[]},
  {"id":"h0041","title":"Title 41","authors":["A. Author"],"year":2020,"doi":"10.0000/h.0041","type":"article","openalex":[]},
  {"id":"h0042","title":"Title 42","authors":["A. Author"],"year":2020,"doi":"10.0000/h.0042","type":"article","openalex":[]},
  {"id":"h0043","title":"Title 43","authors":["A. Author"],"year":2020,"doi":"10.0000/h.0043","type":"article","openalex":[]},
  {"id":"h0044","title":"Title 44","authors":["A. Author"],"year":2020,"doi":"10.0000/h.0044","type":"article","openalex":[]},
  {"id":"h0045","title":"Title 45","authors":["A. Author"],"year":2020,"doi":"10.0000/h.0045","type":"article","openalex":[]},
  {"id":"h0046","title":"Title 46","authors":["A. Author"],"year":2020,"doi":"10.0000/h.0046","type":"article","openalex":[]},
  {"id":"h0047","title":"Title 47","authors":["A. Author"],"year":2020,"doi":"10.0000/h.0047","type":"article","openalex":[]},
  {"id":"h0048","title":"Title 48","authors":["A. Author"],"year":2020,"doi":"10.0000/h.0048","type":"article","openalex":[]},
  {"id":"h0049","title":"Title 49","authors":["A. Author"],"year":2020,"doi":"10.0000/h.0049","type":"article","openalex":[]},
  {"id":"h0050","title":"Title 50","authors":["A. Author"],"year":2020,"doi":"10.0000/h.0050","type":"article","openalex":[]},
  {"id":"h0051","title":"Title 51","authors":["A. Author"],"year":2020,"doi":"10.0000/h.0051","type":"article","openalex":[]},
  {"id":"h0052","title":"Title 52","authors":["A. Author"],"year":2020,"doi":"10.0000/h.0052","type":"article","openalex":[]},
  {"id":"h0053","title":"Title 53","authors":["A. Author"],"year":2020,"doi":"10.0000/h.0053","type":"article","openalex":[]},
  {"id":"h0054","title":"Title 54","authors":["A. Author"],"year":2020,"doi":"10.0000/h.0054","type":"article","openalex":[]},
  {"id":"h0055","title":"Title 55","authors":["A. Author"],"year":2020,"doi":"10.0000/h.0055","type":"article","openalex":[]},
  {"id":"h0056","title":"Title 56","authors":["A. Author"],"year":2020,"doi":"10.0000/h.0056","type":"article","openalex":[]},
  {"id":"h0057","title":"Title 57","authors":["A. Author"],"year":2020,"doi":"10.0000/h.0057","type":"article","openalex":[]},
  {"id":"h0058","title":"Title 58","authors":["A. Author"],"year":2020,"doi":"10.0000/h.0058","type":"article","openalex":[]},
  {"id":"h0059","title":"Title 59","authors":["A. Author"],"year":2020,"doi":"10.0000/h.0059","type":"article","openalex":[]},
  {"id":"h0060","title":"Title 60","authors":["A. Author"],"year":2020,"doi":"10.0000/h.0060","type":"article","openalex":[]},
  {"id":"h0061","title":"Title 61","authors":["A. Author"],"year":2020,"doi":"10.0000/h.0061","type":"article","openalex":[]},
  {"id":"h0062","title":"Title 62","authors":["A. Author"],"year":2020,"doi":"10.0000/h.0062","type":"article","openalex":[]},
  {"id":"h0063","title":"Title 63","authors":["A. Author"],"year":2020,"doi":"10.0000/h.0063","type":"article","openalex":[]},
  {"id":"h0064","title":"Title 64","authors":["A. Author"],"year":2020,"doi":"10.0000/h.0064","type":"article","openalex":[]},
  {"id":"h0065","title":"Title 65","authors":["A. Author"],"year":2020,"doi":"10.0000/h.0065","type":"article","openalex":[]},
  {"id":"h0066","title":"Title 66","authors":["A. Author"],"year":2020,"doi":"10.0000/h.0066","type":"article","openalex":[]},
  {"id":"h0067","title":"Title 67","authors":["A. Author"],"year":2020,"doi":"10.0000/h.0067","type":"article","openalex":[]},
  {"id":"h0068","title":"Title 68","authors":["A. Author"],"year":2020,"doi":"10.0000/h.0068","type":"article","openalex":[]},
  {"id":"h0069","title":"Title 69","authors":["A. Author"],"year":2020,"doi":"10.0000/h.0069","type":"article","openalex":[]},
  {"id":"h0070","title":"Title 70","authors":["A. Author"],"year":2020,"doi":"10.0000/h.0070","type":"article","openalex":[]},
  {"id":"h0071","title":"Title 71","authors":["A. Author"],"year":2020,"doi":"10.0000/h.0071","type":"article","openalex":[]},
  {"id":"h0072","title":"Title 72","authors":["A. Author"],"year":2020,"doi":"10.0000/h.0072","type":"article","openalex":[]},
  {"id":"h0073","title":"Title 73","authors":["A. Author"],"year":2020,"doi":"10.0000/h.0073","type":"article","openalex":[]},
  {"id":"h0074","title":"Title 74","authors":["A. Author"],"year":2020,"doi":"10.0000/h.0074","type":"article","openalex":[]},
  {"id":"h0075","title":"Title 75","authors":["A. Author"],"year":2020,"doi":"10.0000/h.0075","type":"article","openalex":[]},
  {"id":"h0076","title":"Title 76","authors":["A. Author"],"year":2020,"doi":"10.0000/h.0076","type":"article","openalex":[]},
  {"id":"h0077","title":"Title 77","authors":["A. Author"],"year":2020,"doi":"10.0000/h.0077","type":"article","openalex":[]},